{
  "schemaVersion":"1.0.0","commandId":"0198e0a1-0000-7001-8000-000000000001","commandType":"CreateWorkflowRun","aggregateType":"WorkflowRun","aggregateId":"0198e0a1-0000-7002-8000-000000000002","expectedVersion":0,"issuedAt":"2026-08-26T08:10:00Z","actor":{"actorType":"HUMAN","actorId":"local-operator"},"correlationId":"0198e0a1-0000-7003-8000-000000000003","idempotencyKey":"fixture-change-workflow:create:001","payloadSchema":{"schemaId":"urn:aseos:schema:create-workflow-run-payload:1.0.0","schemaVersion":"1.0.0","schemaHash":"1111111111111111111111111111111111111111111111111111111111111111"},"payloadHash":"2222222222222222222222222222222222222222222222222222222222222222","payload":{"workflowDefinitionId":"fixture-change-workflow","workflowDefinitionVersion":"1.0.0","inputArtifactRef":{"artifactId":"0198e0a1-0000-7004-8000-000000000004","sha256":"3333333333333333333333333333333333333333333333333333333333333333","mediaType":"application/json","sizeBytes":128,"sensitivity":"INTERNAL"}},"requestId":"0198e0a1-0000-7005-8000-000000000005"
}
